English,Hindi,Hinglish,bert_base,vader_sentiment
There are four to five generations in a year and generally the pest overwinters as nymph which develops into adult in early spring.,वर्ष में चार-पांच पीढ़ियां पूरी हो जाती हैं और यह पीड़क निम्फ के रूप में सर्दियां पार करके बसंत के आरंभ में प्रौढ़ बन जाता है।,varsh men char-panch piiyan poori ho jati hain aur yah pirak nimph ke roop men sardiyan par karke basnt ke adult in early ban jata hai.,neutral,neutral
A silly position for a fellow of eighteen !,"वैसे यह हास्यास्पद स्थिति है , एक अट्ठारह वर्ष के लड़के के लिए !","vaise yah hasyaspad position hai , ek silly varsh ke larke ke lie !",negative,positive
"Your demand being so reasonable, no impartial person would even suggest that you should moderate it.",आपकी मांग ऐसी है कि कोई निष्पक्ष मनुष्य उसमें काटछांट करनेकी बात सुझा ही नहीं सकता।,aapki demand aesi hai ki koee impartial person usmen katchhant karneki bat reasonable hi nahin sakta.,negative,negative
"If they try to force you to associate with Me that of which you have no knowledge, do not obey them. Live with them honourably in the world, but follow the way of him who turns to Me. Your returning is to Me in the end, when I will tell you what you did.",और अगर तेरे माँ बाप तुझे इस बात पर मजबूर करें कि तू मेरा शरीक ऐसी चीज़ को क़रार दे जिसका तुझे इल्म भी नहीं तो तू (इसमें) उनकी इताअत न करो (मगर तकलीफ़ न पहुँचाना) और दुनिया (के कामों) में उनका अच्छी तरह साथ दे और उन लोगों के तरीक़े पर चल जो (हर बात में) मेरी (ही) तरफ रुजू करे फिर (तो आख़िर) तुम सबकी रुजू मेरी ही तरफ है तब (दुनिया में) जो कुछ तुम करते थे,aur agar tere man bap i is knowledge par majboor karen ki too mera sharik aesi chiz ko rar end jiska i ilm bhi nahin to too ismen unki itaat n karo magar taklif n pahunchana aur live ke kamon men unka achchhi tarah sath end aur un logon ke tarie par chal jo har knowledge men meri hi taraph returning kare phir to aair tum sabki returning meri hi taraph hai tab live men jo kuchh tum karte the,neutral,negative
"Kindness, seriousness and restraint were the balance column",दया विचारशीलता और संयम इसके आधार स्तम्भ थे।,kindness seriousness and restraint iske aadhar balance column,positive,positive
1. This does not function within defined time frame.,1. ये नियमित अंतराल से काम नहीं करती है,1 ye niymit defined se kam nahin karti hai,negative,neutral
Color to draw the Marcus Bains Line in the Time bar (empty for default).,Marcus Bains Line को समय पट्टी में दिखाने के लिए रंग (तयशुदा रूप से खाली).,Marcus Bains Line ko time bar men dikhane ke lie rng tayshuda roop se khali,neutral,negative
Their needs come low on the political agenda in countries that lack money and resources.,धन और साधनों की कमी से जूझते देशों की राजनीतिक प्राथमिकताओं में इन लोगों की जरूरतों का स्थान बहुत नीचे होता है।,dhan aur sadhnon ki kami se joojhte deshon ki rajnitik prathmiktaon men in logon ki jaroorton ka sthan bahut niche hota hai.,negative,negative
how where they think the flag had been changes,कैसे वो सोचते हैं कि कहाँ फ्लैग बदल गया है,kaise vo sochte hain ki kahan flag changes gaya hai,neutral,neutral
He could put up with any and everything but opposition to Urdu and the Anjuman was something he could not bear.,जो कुछ कमाया वह या तो उर्दू पर निछावर कर दिया या दोस्तों और शार्गिदों पर खर्च कर दिया।,jo kuchh something vah ya to urdoo par nichhavar kar diya ya doston aur shargidon par kharch kar diya.,negative,neutral
"Or like abundant rain from the cloud in which is utter darkness and thunder and lightning; they put their fingers into their ears because of the thunder peal, for fear of death, and Allah encompasses the unbelievers.","या (उनकी मिसाल ऐसी है) जैसे आकाश से वर्षा हो रही हो जिसके साथ अँधेरे हों और गरज और चमक भी हो, वे बिजली की कड़क के कारण मृत्यु के भय से अपने कानों में उँगलियाँ दे ले रहे हों-और अल्लाह ने तो इनकार करनेवालों को घेर रखा हैं","ya unki unbelievers aesi hai jaise cloud se rain ho rahi ho jiske sath darkness hon aur thunder aur chamak bhi ho , ve lightning ki karak ke karan death ke fear se apne fingers men ungliyan de le rahe hon-aur allah ne to inkar karnevalon ko gher rakha hain",negative,negative
Set the browser to view only this genre,ब्राउजर को सिर्फ ये शैल प्रदर्षित करने के लिए निश्चित करें,browser ko sirph ye shail genre karne ke lie nishchit karen,neutral,neutral
The increasing adoption of the continuous casting process by the integrated steel plants would mean that they will themselves use most of the scrap generated by them .,समन्वित इस्पात मिलों द्वारा निरन्तर कास्टिंग प्रक्रिया के अपनाने का अर्थ होगा कि अपने ही संयंत्रों से निकले टुकड़ों ( स्क्रेप ) का वे स्वयं उपयोग करेंगे .,samanvit steel most dvara continuous casting process ke adoption ka arth hoga ki apne hi snyntron se nikle scrap skrep ka ve svyn upyog karenge,neutral,neutral
Almost all Political Parties with their representatives contest the election for Counselor.,पार्षदों के चुनाव हेतु लगभग सभी राजनीतिक पार्टियां अपने प्रत्याशि खड़े करतीं हैं।,parshdon ke election hetu lagabhag sabhi political partiyan apne representatives khare kartin hain.,neutral,positive
Construction of Farkka dam has been helpful in production of seed of hilsa fish.,फरक्का बांध बन जाने से गंगा नदी में हिल्सा मछली के बीजोत्पादन में सहायता मिली है।,construction dam ban jane se gnga nadi men production fish ke farkka men sahayta mili hai.,positive,positive
India and Togo enjoy warm and friendly relations.,भारत और टोगो के प्रगाढ़ और मैत्रीपूर्ण संबंध हैं।,india aur togo ke enjoy aur friendly relations hain.,positive,positive
"But there are signs of a renaissance and, given that youth organizations provide adolescents' main experience of democracy, their strengthening will be an essential buttress to future human rights in the country.",युवा संगठन किशोरों को लोकतंत्र का अनुभव प्रदान करते हैं इसलिए उन्हें मजबूत करने से भविष्य में देश में मानव अधिकारों की आवश्यक बुनियाद तैयार होगी।,youth organizations kishoron ko loktntr ka anubhav prdan karte hain islie unhen majboot karne se experience of democracy men manav adhikaron ki aavashyak buniyad taiyar hogi.,positive,positive
"The poet feels inspired by Parmanand Almast, that aspect of Lord Shiva which symbolises Truth and Beauty.",कवि को शिव का सत्य और सुन्दर रूप अधिक प्रेरक लगता है।,poet ko lord ka truth aur beauty aspect adhik prerak feels hai.,positive,positive
Gandhiji’s talisman for the country 's rulers was simple and powerful and I quote:,देश के शासकों के लिए गांधी जी का मंत्र सरल और शक्तिशाली थाः,country ke rulers ke lie gandhi ji ka talisman simple and powerful thaa,positive,positive
He works towards impacting the environment in a positive manner through his own actions as well as by imparting knowledge amongst students to help them achieve their potential.,वह अपने कार्यों के जरिए तथा विद्यार्थियों को अपनी क्षमता अर्जित करने में मदद करने के लिए ज्ञान प्रदान करके वातावरण को सकारात्मक तरीके से प्रभावित करने का कार्य करता है।,vah apne actions ke jarie towards students ko apni own arjit karne men madad karne ke lie knowledge prdan karke environment ko positive tarike se prbhavit karne ka kary karta hai.,positive,positive
When it is legal act by illegal means over act is necessary.,जब अवैध तरीकों से कानूनी कार्रवाई की गयी है तब यह अधिनियम आवश्यक है.,jab illegal means se legal karrvaee ki gayi hai tab yah act necessary hai,neutral,negative
But Nanak was for more knowledgeable than his teachers.,लेकिन नानक का ज्ञान गुरु से कहीं बढ़-चढ़ कर था।,lekin teachers ka jnjan guru se kahin ba-cha kar tha.,neutral,neutral
"To change time or date settings, you need to authenticate.","समय या दिनांक सेटिंग्स को बदलने के लिए, आपको प्रमाणित करने की जरूरत है.","time or date settings ko change ke lie, aapko authenticate karne ki jaroorat hai",neutral,neutral
"In case of accidents: If any labourer gets bodily injury during the course of employment at work site, the person is entitled to free medical treatment from the State Government.",दुर्घटना की स्थिति में-यदि कोई कामगार कार्यस्थल पर कार्य के दौरान घायल होता है तो राज्य सरकार की ओर से वह निःशुल्क चिकित्सा सुविधा पाने का हकदार होगा।,case of accidents men-ydi koee work site par kary ke dauran ghayal hota hai to rajy sarkar ki or se vah free medical treatment pane ka free medical,neutral,positive
Those! theirs shall be a provision known:,उनके वास्ते (बेहिश्त में) एक मुक़र्रर रोज़ी होगी,unke provision behisht men ek murrar rozi hogi,positive,neutral
And He subjected the night and the day for you – and the sun and the moon; and the stars are subjected to His command; indeed in this are signs for people of intellect.,उसी ने तुम्हारे वास्ते रात को और दिन को और सूरज और चाँद को तुम्हारा ताबेए बना दिया है और सितारे भी उसी के हुक्म से (तुम्हारे) फरमाबरदार हैं कुछ शक़ ही नहीं कि (इसमें) समझदार लोगों के वास्ते यक़ीनन (कुदरत खुदा की) बहुत सी निशानियाँ हैं,usi ne tumhare vaste rat ko aur din ko aur sooraj aur chand ko tumhara tabee bana diya hai aur sitare bhi usi ke hukm se tumhare pharmabardar hain kuchh sha hi nahin ki ismen samajhdar logon ke vaste yainan kudarat khuda ki bahut si nishaniyan hain,positive,positive
Inevitable losses is pushing the profit in unfavourable direction.,अपरिहार्य हानियाँ लाभ को प्रतिकूल दिशा में धकेल रही हैं।,inevitable losses profit ko unfavourable direction men dhakel rahi hain.,negative,positive
Inflammation related to the tissues around the larynx.,स्वरयंत्र के चारों ओर पाए जाने वाले ऊतक से संबंधी प्रदाह,larynx ke charon or pae jane vale ootak se inflammation related,negative,neutral
"He said, “Our Lord is He who gave everything its existence, then guided it. ”",मूसा ने कहा हमारा परवरदिगार वह है जिसने हर चीज़ को उसके (मुनासिब) सूरत अता फरमाई,gave ne kaha hamara lord vah hai jisne har chiz ko uske munasib soorat ata pharmaee,positive,neutral
Remove the validity tests on this cell,इस कक्ष पर वैधता जांच हटाएं,is cell par validity janch hataen,negative,neutral
Central European (_ MacCE),मध्य यूरोपीय (_ MacCE),central european _ MacCE,neutral,neutral
Where the front skin join with the area under the penis. called as joint of front skin (farunulum).,शिश्न के निचली ओर का वह क्षेत्र जहाँ से अग्रत्वचा जुड़ी रहती है अग्रत्वचा का बंध (फेरुनुलम) कहलाता है।,penis ke nichli or ka vah area jahan se front juri rahti hai front ka bndh joint kahlata hai.,neutral,positive
"As mentioned at the very beginning of this book, had it not been for these insects we would not have had our vegetation and landscape.",जैसा कि इस पुस्तक के प्रारंभ में ही बताया जा चुका है अगर ये कीट न होते तो न तो हमारी वनस्पति होती और न हमें भूदृश्य देखने को मिलते.,jaisa ki is pustak ke prarnbh men hi bataya ja chuka hai agar ye kit n hote to n to hamari vanaspti hoti aur n hamen bhoodrishy dekhne ko milte,neutral,neutral
"“And if you deny, then many nations have denied before you; and the Noble Messenger is not responsible except to plainly convey (the message). ”","और यदि तुम झुठलाते हो तो तुमसे पहले कितने ही समुदाय झुठला चुके है। रसूल पर तो बस केवल स्पष्ट रूप से (सत्य संदेश) पहुँचा देने की ज़िम्मेदारी है। """,aur yadi tum jhuthlate ho to tumse pahle kitne hi samuday jhuthla chuke hai. rasool par to bas keval spasht roop se saty sndesh pahuncha dene ki zimmedari hai.,negative,negative
"Those who were arrogant said, “We reject what you believe in. ”",तब जिन लोगों को (अपनी दौलत दुनिया पर) घमन्ड था कहने लगे हम तो जिस पर तुम ईमान लाए हो उसे नहीं मानते,tab jin logon ko apni daulat duniya par arrogant tha kahne lage ham to jis par tum eeman lae ho use nahin mante,negative,negative
It is the best source of soluble fibre.,यह घुलनशील रेशे का सर्वश्रेष्ठ स्रोत है।,yah soluble fibre ka sarvashreshth srot source,positive,positive
"And when it was said to them: Reside in this town and eat from it wherever you wish, and say, Put down from us our heavy burdens: and enter the gate making obeisance, We will forgive you your wrongs: We will give more to those who do good (to others).",और जब उनसे कहा गया कि उस गाँव में जाकर रहो सहो और उसके मेवों से जहाँ तुम्हारा जी चाहे (शौक़ से) खाओ (पियो) और मुँह से हुतमा कहते और सजदा करते हुए दरवाजे में दाखिल हो तो हम तुम्हारी ख़ताए बख्श देगें और नेकी करने वालों को हम कुछ ज्यादा ही देगें,aur jab unse kaha gaya ki us town men making heavy reside aur uske mevon se jahan tumhara wrongs chahe eat se khao piyo aur munh se hutma kahte aur obeisance karte hue gate men dakhil ho to ham tumhari burdens bakhsh others aur neki karne valon ko ham kuchh good hi others,positive,positive
"Before road transport developed, the principal arteries of communication during those days were the river routes.",सड़कों के विकास के पहले उन दिनों नदियों के मार्ग ही यातायात के प्रमुख साधन थे।,road ke vikas ke pahle un dinon nadiyon ke marg hi yatayat ke prmukh sadhan the.,neutral,neutral
"Questions may be about the treatment itself, for example:","सवाल वैद्यकिय उपचार के बारे में भी हो सकते हैं, जैसे कि उदाहरण के तौर पर:","questions vaidykiy treatment ke bare men bhi ho sakte hain, jaise ki udaharan ke taur par:",neutral,neutral
One consequence of this kind of segregation was that there was usually little mental companionship between husband and wife .,इस तरह के अलगाव का एक परिणाम यह था कि साधारणतया पति और पत्नी के बीच सहचारिता नहीं थी .,is tarah ke segregation ka ek consequence yah tha ki sadharanatya husband and wife ke mental companionship nahin thi,negative,neutral
"Unable to send memo information, the memo does not exist","ज्ञापन सूचना देने में असमर्थ, यह ज्ञापन मौजूद नहीं है","memo information dene men unable, yah memo maujood nahin hai",negative,neutral
"So the Government of India had no reason to revise its educational and cultural policy, which had been one of the causes of the Revolt of 1857, but decided to enforce it more systematically and thoroughly with the help of a large section of Indians.","इसलिए भारत सरकार के पास उनकी शैक्षणिक और सांस्कृतिक नीति को संशोधित करने का कोई कारण नहीं रहा, जो कि 1857 के विद्रोह का एक कारण था, बल्कि बड़ी संख्या में भारतीयों की सहायता से उसे और सुव्वस्थित ढ़ग से अच्छी तरह कार्यान्वित करने का निश्चय किया।","islie india government ke pas unki educational aur cultural policy ko snshodhit karne ka koee reason nahin raha , jo ki 1857 ke revolt ka ek reason tha , balki large snkhya men bhartiyon ki help se use aur suvvasthit g se achchhi tarah karyanvit karne ka nishchay kiya.",neutral,positive
Underline color for misspelled words when using inline spelling.,इनलाइन वर्तनी प्रयोग के दौरान गलत वर्तनी वाले शब्द रंग से रेखांकित करें.,color for misspelled ke dauran galat vartni vale shabd rng se rekhankit karen,neutral,neutral
And He subjected the night and the day for you – and the sun and the moon; and the stars are subjected to His command; indeed in this are signs for people of intellect.,उसी ने तुम्हारे वास्ते रात को और दिन को और सूरज और चाँद को तुम्हारा ताबेए बना दिया है और सितारे भी उसी के हुक्म से (तुम्हारे) फरमाबरदार हैं कुछ शक़ ही नहीं कि (इसमें) समझदार लोगों के वास्ते यक़ीनन (कुदरत खुदा की) बहुत सी निशानियाँ हैं,usi ne people vaste night ko aur day ko aur sun aur moon ko tumhara tabee bana diya hai aur sitare bhi usi ke hukm se people pharmabardar hain kuchh sha hi nahin ki ismen intellect logon ke vaste yainan kudarat khuda ki bahut si nishaniyan hain,positive,positive
Amritsar is famous for the Golden Temple.,अमृतसर स्वर्ण मंदिर के लिए प्रसिद्ध है।,amritsar golden temple ke lie famous hai.,positive,neutral
Unable to launch %s: %s,%s लांच करने में असमर्थ: %s,s lanch karne men unable: s,negative,neutral
They are rather big egoists.,ऐसे लोग बहुत ही अहमवादी होते हैं।,aese big bahut hi ahamvadi hote hain.,negative,neutral
"waxing proud in the land, and devising evil; but evil devising encompasses only those who do it; So do they expect anything but the wont of the ancients? And thou shalt never find any changing the Wont of God, and thou shalt never find any altering the wont of God.",(उसके आने से) उनकी नफरत को तरक्की ही होती गयी और बुदी तद्बीर (की बुराई) तो बुरी तद्बीर करने वाले ही पर पड़ती है तो (हो न हो) ये लोग बस अगले ही लोगों के बरताव के मुन्तज़िर हैं तो (बेहतर) तुम खुदा के दसतूर में कभी तब्दीली न पाओगे और खुदा की आदत में हरगिज़ कोई तग़य्युर न पाओगे,uske aane se unki napharat ko tarakki hi hoti gayi aur budi tadbir ki buraee to buri tadbir karne vale hi par parti hai to ho n ho ye log bas agle hi logon ke bartav ke muntazir hain to behatar tum khuda ke dastoor men kabhi tabdili n paoge aur khuda ki aadat men hargiz koee tayyur n paoge,negative,negative
They are rather big egoists.,ऐसे लोग बहुत ही अहमवादी होते हैं।,aese log bahut hi ahamvadi hote hain.,negative,neutral
"Until he was eight,there was instability lagging to him for which no arrangement for education could be made.",जब तक अकबर आठ वर्ष का हुआ जन्म से लेकर अब तक उसके सभी वर्ष भारी अस्थिरता में निकले थे जिसके कारण उसकी शिक्षा-दीक्षा का सही प्रबंध नहीं हो पाया था।,jab tak akabar education varsh ka huaa janm se lekar ab tak uske sabhi varsh bhari instability men nikle the jiske karan uski shiksha-diksha ka sahi arrangement nahin ho paya tha.,negative,negative
"Let all those who care and long for freedom and the independence of India meet this test with strength and confidence, and march together to the free India of our dreams. 1 do not think that the Hindu Mahasabha can get any seat except in Bengal.","जो लोग भारत की आजादी के लिए चिन्ता करते हैं और उसके इच्छुक हैं, वे सब शान्ति और विश्वास के साथ इस कसौटी का सामना करें और हमारे सपनों के स्वतंत्र भारत की दिशा में कंधे से कंधा मिलाकर आगे बढें।","jo log bharat ki aajadi ke lie chinta karte hain aur uske ichchhuk hain, ve sab shanti aur vishvas ke sath is meet this test karen aur hamare sapnon ke svtntr bharat ki disha men kndhe se kndha milakar aage badhen.",positive,positive
