English,Hindi,Hinglish,bert_base,vader_sentiment
When it is legal act by illegal means over act is necessary.,जब अवैध तरीकों से कानूनी कार्रवाई की गयी है तब यह अधिनियम आवश्यक है.,jab avaidh tarikon se legal act ki gayi hai tab yah adhiniyam aavashyak hai,neutral,negative
In old Tamil literature also one comes across the murasu quite often .,प्राचीन तमिल साहित्य में मुरसु का भी कई जगह उल्लेख हुआ है .,prachin tamil literature men mursu ka bhi kee jagah ullekh huaa hai,neutral,neutral
"'. After the 25th, Prem Chand did not have good sleep.",25 की रात के बाद ठीक से कभी सो न सके।,sleep ki good ke bad thik se kabhi so n sake.,negative,negative
"And never [O Muhammad] pray for one of them who dies, nor stand by his grave. For they denied God and His Messenger, and died rebellious.",औऱ उनमें से जिस किसी व्यक्ति की मृत्यु हो उसकी जनाज़े की नमाज़ कभी न पढ़ना और न कभी उसकी क़ब्र पर खड़े होना। उन्होंने तो अल्लाह और उसके रसूल के साथ कुफ़्र किया और मरे इस दशा में कि अवज्ञाकारी थे,au unmen se jis kisi vyakti ki pray ho god janaze ki stand kabhi n pana aur n kabhi god br par khare hona. unhonne to messenger aur uske rasool ke sath kufr kiya aur mare is dasha men ki rebellious the,negative,negative
"Now, a simple way for you to start","अब, तुम शुरू करने के लिए एक सरल तरीका","ab, tum start karne ke lie ek simple tarika",positive,neutral
"From 1998 - 99, various poverty alleviation and employment generation programmes are grouped under two broad categories of:",वर्ष 1998-99 से चलने वाले कई तरह के गरीबी उन्मूलन तथा रोजगार सृजन कार्यक्रमों को व्यापक रूप से दो वर्गों में रखे गए हैंः,employment 1998-99 se chalne vale kee tarah ke poverty various tatha generation srijan programmes ko broad categories se do vargon men rakhe ge haina,neutral,negative
LEVEL : NEWS PAPERS IN HINDI LANGUAGE,श्रेणी:हिन्दी भाषा के समाचार पत्र,level : hindi language ke news papers,neutral,neutral
Starting sequence number (deprecated),आरंभिक शृंखला संख्या (पदावनत),aarnbhik sequence number padavanat,neutral,positive
"The same word or signal, therefore, should always be used for the particular response desired.",इसलिए इच्छित अनुक्रिया के लिए सदा ही एक शब्द अथवा संकेत का इस्तेमाल किया जाना चाहिए।,islie response desired ke lie sada hi ek word or signal ka istemal kiya jana chahie.,neutral,positive
A type of reproduction without fertilization.,निषेचन रहित प्रजनन का एक प्रकार,reproduction without fertilization ka ek type,neutral,neutral
But this exclusive consummation is not the sole or inevitable result of the Path of Knowledge.,किन्तु यह एकाग्डी अत्युच्च अवस्था ही ज्ञान के मार्ग का अकेला या अनिवार्य परिणाम नहीं।,kintu yah ekagdi atyuchch avastha hi knowledge ke path ka sole ya inevitable result nahin.,neutral,positive
They embrace the infinite coastline of the sea at their mouths.,वे अपने मुहानों पर असीम समुद्रतट का आलिंगन करती हैं।,ve apne muhanon par infinite sea ka aalingan karti hain.,positive,positive
"When such a person comes to Us, he will say [to his comrade], ""If only you had been as far away from me as east is from west. What an evil comrade!""",यहाँ तक कि जब (क़यामत में) हमारे पास आएगा तो (अपने साथी शैतान से) कहेगा काश मुझमें और तुममें पूरब पश्चिम का फ़ासला होता ग़रज़ (शैतान भी) क्या ही बुरा रफीक़ है,yahan tak ki jab yamat men hamare pas aaega to apne comrade shaitan se kahega kash mujhmen aur person east west ka fasla hota raz shaitan bhi kya hi evil raphi hai,negative,negative
Now I do call to witness the Lord of all points in the East and the West that We can certainly -,"अतः कुछ नहीं, मैं क़सम खाता हूँ पूर्वों और पश्चिमों के रब की, हमे इसकी सामर्थ्य प्राप्त है","ata kuchh nahin, main sam khata hoon poorvon aur pashchimon ke rab ki, hame iski samarthy prapt hai",positive,positive
"There is a great percentage of poetry in his so - called dramas, also there is music in them.","उनके तथाकथित नाटकों में, कविताओं का अंश मुख्य है, उनमें संगीत भी शामिल है।","unke tathakthit dramas men , poetry ka percentage great hai , unmen music bhi shamil hai.",positive,positive
Decisions in a proprietary concern are easy and prompt.,स्वामित्व प्रतिष्ठान में निर्णय सुगमता से और त्वरित रूप में लिए जा सकते हैं।,proprietary concern men nirnay sugamta se aur tvrit roop men lie ja sakte hain.,positive,positive
Image format (default RGB),छवि प्रारूप (डिफ़ॉल्ट RGB),image format default rgb,neutral,neutral
Failed to unlock lock file '% s' '% s',लॉक फ़ाइल को अन-लॉक करने में असफ़ल,lock unlock lock file karne men asafal,negative,negative
Whether to show contacts that are offline in the contact list.,क्या संपर्कों को दिखाना है जो संपर्क सूची में ऑफ़लाइन हैं.,kya contact ko dikhana hai jo contacts list men offline hain,neutral,negative
"then makes him to die, and buries him,",फिर उसे मौत दी फिर उसे कब्र में दफ़न कराया,phir use maut di phir use kabr men dafan karaya,negative,negative
has the minimum number of wiggles.,उसमे सबसे कम हलचल होता है.,usme sabse kam number hota hai,neutral,positive
Thus the word of your Lord is fulfilled concerning the transgressors that they shall not believe.,ये तुम्हारे परवरदिगार की बात बदचलन लोगों पर साबित होकर रही कि ये लोग हरगिज़ ईमान न लाएँगें,ye lord paravardigar ki word transgressors logon par sabit hokar rahi ki ye log hargiz eeman n laengen,positive,positive
"Have they not realised that God knows their secrets and their confidential talk, and that God has the knowledge of unknown things?",क्या उन्हें खबर नहीं कि अल्लाह उनका भेद और उनकी कानाफुसियों को अच्छी तरह जानता है और यह कि अल्लाह परोक्ष की सारी बातों को भली-भाँति जानता है,kya unhen khabar nahin ki allah unka bhed aur unki kanaphusiyon ko achchhi tarah janta hai aur yah ki allah knowledge of unknown baton ko bhali-bhanti janta hai,neutral,positive
The default browser is currently %{BROWSERNAME}.,वर्तमान में डिफ़ॉल्ट ब्राउज़र %{BROWSERNAME} है.,vartman men default browser BROWSERNAME hai,neutral,neutral
"This apple tastes sour, doesn 't it?",यह सेव खट्टा है ना?,yah apple sour hai na,negative,neutral
It is right that we should put all our strength in the advancement of the cause that we hold dear.,"यह बहुत ठीक है कि जो मकसद हमें प्यारा है, उसको पूरा करने के लिए हम अपनी पूरी ताकत लगा दें।","yah bahut thik hai ki jo makasad hamen pyara hai, usko poora karne ke lie ham apni poori takat laga den.",positive,positive
Construction of Farkka dam has been helpful in production of seed of hilsa fish.,फरक्का बांध बन जाने से गंगा नदी में हिल्सा मछली के बीजोत्पादन में सहायता मिली है।,pharakka bandh ban jane se gnga production of seed machhli ke bijotpadan helpful in production hai.,positive,positive
"And there came a caravan of travellers and they sent their water - drawer to draw water from the well. He let down his bucket into the well and he exclaimed, ""Oh, what a lucky find, here is a boy!"" They hid him like a piece of merchandise, but God knew well what they did.","एक क़ाफ़िला आया। फिर उसने पनिहारा को भेजा। उसने अपना डोल ज्यों ही डाला तो पुकार उठा, ""अरे! कितनी ख़ुशी की बात है। यह तो एक लड़का है।"" उन्होंने उसे व्यापार का माल समझकर छुपा लिया। किन्तु जो कुछ वे कर रहे थे, अल्लाह तो उसे जानता ही था","ek afila aaya. phir usne panihara ko bheja. usne apna draw water hi dala to pukar utha, are! kitni ushi ki bat hai. yah to ek larka hai. unhonne use vyapar ka mal samajhkar chhupa liya. kintu jo kuchh ve kar rahe the, allah to use janta hi tha",positive,positive
"This appeal has impugned the judgment and decree dated 20. 01. 2007 which had endorsed the judgment and decree of the trial judge dated 08. 11. 2005 decreeing the suit of the plaintiff for possession, declaration and mandatory injunction","इस अपील ने २०. ०१. २००७ दिनांकित निर्णय और डिक्री पर आक्षेप किया है, जिसने ०८. ११. २००५ दिनांकित विचारण के निर्णय और डिक्री का समर्थन किया था, जिसमें वादी के कब्जे, घोषणा और अनिवार्य निषेधाज्ञा के वाद पर डिक्री की गई थी.","is appeal ne २० ०१ २००७ dinankit judgment aur decree par aakshep kiya hai , jisne ०८ ११ २००५ dinankit trial ke judgment aur decree ka samarthan kiya tha , jismen plaintiff ke possession , declaration aur mandatory injunction ke suit par decree ki gee thi",negative,positive
We should ensure that these pillars remain strong and unshakable.,हमें यह सुनिश्चित करना चाहिए कि इन स्तंभों की सुदृढ़ता और अविचलता बनी रहे।,hamen yah sunishchit karna chahie ki in pillars ki sudrita aur strong bani rahe.,positive,positive
Two kinds of poultry feed may be prepared.,दो तरह के मुर्गी चारे तैयार किए जा सकते हैं।,do tarah ke poultry feed prepared kie ja sakte hain.,neutral,positive
It contains seven vertical strokes followed by this fish-like sign.,समें सात ऊर्ध्वाधर रेखाओं के पीछे एक मछली का चिन्ह है।,strokes sat oordhvadhar rekhaon ke pichhe ek machhli ka fish-like sign,neutral,neutral
They both grew up in more or less the same atmosphere.,दोनों कमोबेश एक ही वातावरण में पालित-पोषित हुए थे।,donon kamobesh ek hi atmosphere men palit-poshit hue the.,neutral,neutral
Of his party was also Abraham;,और इबराहीम भी उसी के सहधर्मियों में से था।,aur ibrahim bhi usi ke party men se tha.,neutral,positive
"It was during the time of the dictatorship of Herod that Jesus was born, when the condition of the rule was dismal.",ईसु के जन्म के समय निरकुंश राजा हैरोद का शासन था जिसमे प्रजा की स्थिति शोचनीय थी।,jesus ke janm ke time nirkunsh raja hairod ka rule tha jisme prja ki condition shochniy thi.,negative,negative
And we 're going to expand it into two simpler expressions,और हम दो सरल भाव में विस्तृत करने के लिए जा रहे हैं,aur ham do simpler expressions men expand karne ke lie ja rahe hain,neutral,positive
Pro tempore appointment means an appointment carrying a definite rate of pay sanctioned for a limited time only.,"अल्पकालीन नियुक्ति का अर्थ उस नियुक्ति से होता है, जिसमें मात्र एक निश्चित समयावधि के लिए ही निश्चित दर से वेतन स्वीकृत होता है।","alpkalin appointment ka arth us appointment se hota hai , jismen matr ek definite limited ke lie hi definite rate se pay svikrit hota hai.",neutral,negative
"He said, “Stop it – peace be upon you; I shall seek forgiveness for you from my Lord; indeed He is very kind to me. ”",इबराहीम ने कहा (अच्छा तो) मेरा सलाम लीजिए (मगर इस पर भी) मैं अपने परवरदिगार से आपकी बख्शिश की दुआ करूँगा,peace ne kaha forgiveness to mera salam lijie magar is par bhi main apne paravardigar se aapki bakhshish ki duaa karoonga,positive,positive
"And he said: ye have taken images instead of Allah out of affection between you in the life of the world; but on the Day of Resurrection ye shall deny each other and ye shall curse each other, and your resort shall be the Fire, and ye shall have no helpers.","और उसने कहा, ""अल्लाह से हटकर तुमने कुछ मूर्तियों को केवल सांसारिक जीवन में अपने पारस्परिक प्रेम के कारण पकड़ रखा है। फिर क़ियामत के दिन तुममें से एक-दूसरे का इनकार करेगा और तुममें से एक-दूसरे पर लानत करेगा। तुम्हारा ठौर-ठिकाना आग है और तुम्हारा कोई सहायक न होगा।""","aur usne kaha , allah se hatakar tumne kuchh images ko keval sansarik life men apne parasprik affection ke karan pakar rakha hai. phir resurrection ke day ye se ek-doosre ka inkar karega aur ye se ek-doosre par lanat karega. other thaur-thikana fire hai aur other koee helpers n resort",negative,negative
They roam about widely in search of food .,इस जाति के पक्षी भोजन की खोज में दूर दूर तक घूमते हैं .,is jati ke pakshi search of food men widely roam about widely hain,neutral,neutral
Nibbles couldn 't find pixmap file:% s Please check your Nibbles installation,निब्बल्स पिक्समेप फ़ाइल:% s ढूंढ नहीं सका. कृपया अपना निब्बल्स संस्थापना जांचें,nibbles pixmap s : s dhoondh nahin saka please apna nibbles snsthapna janchen,negative,positive
But they also built a playhouse in 1753 which closed down when the Fort and Calcutta were lost in battle to Nawab Siraj - ud - Dowla in 1756.,"किंतु उन्होंने सन् 1753 में एक नाटकघर भी बनवाया, जो कि सन् 1756 के युद्ध में किले और कलकत्ता के नवाब सिराजुद्दौला के हाथ में चले जाने पर बंद हो गया।","kintu unhonne playhouse 1753 men ek natakaghar bhi banvaya , jo ki playhouse 1756 ke battle men fort aur calcutta ke navab siraj ke hath men chale jane par bnd ho gaya.",neutral,negative
"Winds built up to 65 kph and waves broke on the boat, deluging it with water.",हवा का वेग बढ़कर 65 किलोमीटर प्रति घंटा हो गया और विशालकाय लहरें नौका से टकराने लगीं और उसे पानी से भर दिया।,hava ka veg bakar 65 kilomitar prti ghnta ho gaya aur vishalkay lahren nauka se takrane lagin aur use pani se bhar diya.,negative,negative
Something like this is happening to Farooq Abdullah.,कुछ ऐसी ही बात फारूक अदुल्ल के साथ हो रही है.,kuchh aesi hi bat pharook happening ke sath ho rahi hai,negative,positive
"What are they waiting for – except the Last Day, that it may suddenly come upon them while they are unaware?",क्या वे बस उस (क़ियामत की) घड़ी की प्रतीक्षा कर रहे है कि वह सहसा उनपर आ पड़े और उन्हें ख़बर भी न हो,ve bas us last ki ghari ki prtiksha kar rahe hai ki vah unaware unapar aa pare aur unhen bar bhi n ho,neutral,negative
"And they will offer (their full) submission to Allah (Alone) on that Day, and their invented false deities [all that they used to invoke besides Allah, e. g. idols, saints, priests, monks, angels, jinns, Jibrael (Gabriel), Messengers, etc.] will vanish from them.",उस दिन वे अल्लाह के आगे आज्ञाकारी एवं वशीभूत होकर आ पड़ेगे। और जो कुछ वे घड़ा करते थे वह सब उनसे खोकर रह जाएगा,us din ve allah ke aage aajnjakari evn vashibhoot hokar aa parege. aur jo kuchh ve ghara karte the vah sab unse khokar rah jaega,negative,negative
"Accursed wherever they are found, [being] seized and massacred completely.",फिटकारे हुए होंगे। जहाँ कही पाए गए पकड़े जाएँगे और बुरी तरह जान से मारे जाएँगे,accursed hue honge. jahan kahi pae ge pakare jaenge aur buri tarah jan se mare jaenge,negative,neutral
Could not decode private key.,निजी कुंजी को विगोपित नहीं कर सका.,private key ko decode nahin kar saka,negative,neutral
It will act as a platform where novel ideas are nurtured and innovators mentored to develop new products.,यह एक ऐसे मंच के रूप में कार्य करेगा जहां नवीन विचारों को प्रोत्साहन मिलेगा और नए उत्पादों के विकास के लिए नवान्वेषकों को प्रोत्साहित किया जाएगा।,yah ek aese platform ke roop men kary karega jahan novel ideas ko protsahan milega aur ne products ke vikas ke lie innovators ko protsahit kiya jaega.,positive,positive
That 's why he stole the salver.,चांदी की थाली की चोरी इसी कारण की है।,chandi ki stole the salver isi karan ki hai.,negative,neutral
"The next thing is that, if you want to predict","दूसरी ये कि, यदि आप पूर्वानुमानित करना चाहें","next ye ki , yadi aap poorvanumanit karna chahen",neutral,positive
A type of reproduction without fertilization.,निषेचन रहित प्रजनन का एक प्रकार,fertilization rahit reproduction ka ek type,neutral,neutral
"Discussions in the assembly were marked by elements of purity, fairness, frankness and freedom.","सभा में चर्चाएं स्वतंत्र, स्वच्छ एवं निर्बाध हुआ करती थीं.","assembly frankness and freedom, svachchh evn nirbadh huaa karti thin",positive,positive
"for example, in this case,","उदाहरण के तौर पर, यहाँ,","udaharan ke taur par, yahan,",neutral,neutral
In the past year Germany also expressed its willingness to tap the vast skilled manpower pool India enjoys in the area of Information Technology.,गत वर्ष जर्मनी ने इच्छा प्रकट की कि सूचना प्रौद्योगिकी के क्षेत्र में प्रशिक्षित भारतीयों की प्रतिभा का लाभ जर्मनी उठाना चाहता है।,gat varsh jarmni ne ichchha prakat ki ki information technology ke vast skilled manpower bhartiyon ki prtibha ka labh jarmni uthana chahta hai.,positive,positive
He told me to go to his room.,उसने मुझे उसके कमरे में जाने को कहा।,told mujhe uske room men jane ko kaha.,neutral,neutral
They roam about widely in search of food .,इस जाति के पक्षी भोजन की खोज में दूर दूर तक घूमते हैं .,is jati ke pakshi food ki search men door door tak ghoomte hain,neutral,neutral
"When they came to a gutter filled with rain water, they plunged in, scream - ing with laughter.","छोकरे जब बारिश के पानी से भरा नाली के निकट पहुंचे, तो उसी में कूद पड़े और धमाचौकड़ी मचाते हुए हो-हल्ला करने लगे।","laughter jab rain ke water se bhara gutter ke nikat pahunche , to usi men ing pare aur dhamachaukari machate hue ho-halla karne lage.",negative,positive
"Say: “He is Allah, the One and Unique;",(ऐ रसूल) तुम कह दो कि ख़ुदा एक है,say unique tum kah do ki uda ek hai,positive,neutral
My special congratulations to Shri Shashi Kapoor who has been honoured with the Dadasaheb Phalke Award this year.,श्री शशि कपूर को मेरी विशेष बधाई जिन्हें इस वर्ष दादा साहेब फाल्के पुरस्कार प्रदान किया गया है।,shri shashi kapoor ko meri vishesh badhaee jinhen is varsh dada award this year prdan kiya gaya hai.,positive,positive
Unable to open lock file.,लाक फ़ाइल खोलने में अक्षम.,lock unable kholne men aksham,negative,neutral
"Polar ice caps may melt further and increase the size of the oceans which may submerge large expanses of land - LRB - China, Egypt, Indonesia, Bangladesh and West Bengal face this threat - RRB -.","अधिक मात्रा में ध्रुवों की बर्फ पिघलने से सागरों में जल का स्तर बढ़ जाएगा. जिससे पृथ्वी का काफी बड़ा भू-भाग इसमें डूब जाएगा. चीन, मिस्त्र, इन्डोनेशिया, बंग्लादेश और पश्चिम बंगाल के लिए यह खतरा मंडरा रहा है.","adhik polar ice caps ki ice caps se sagron men jal ka star ba jaega jisse prithvi ka kaphi bara bhoo-bhag ismen doob jaega chin, mistr, indoneshiya, bngladesh aur pashchim bngal ke lie yah khatra mndra raha hai",negative,negative
“It 's nice for swimming there. ”,पानी में तैरने का वहाँ बहुत बढ़िया इन्तज़ाम है।,pani men nice ka vahan bahut baiya intazam hai.,positive,positive
"So, I need to decipher what I wrote.","तो, मुझे समझने की जरुरत है कि मैंने क्या लिखा है।","to, mujhe decipher ki jarurat hai ki mainne kya likha hai.",neutral,neutral
