English,Hindi,Hinglish,bert_base,vader_sentiment
I am angry with Megan because she did not invite me to her party.,मैं मेगन से क्रुद्ध हूं क्योंकि उसने अपने पार्टी में मुझे आमंत्रित नहीं किया था।,i megan se angry hoon kyonki usne apne party men mujhe aamntrit nahin kiya tha.,negative,negative
In the past year Germany also expressed its willingness to tap the vast skilled manpower pool India enjoys in the area of Information Technology.,गत वर्ष जर्मनी ने इच्छा प्रकट की कि सूचना प्रौद्योगिकी के क्षेत्र में प्रशिक्षित भारतीयों की प्रतिभा का लाभ जर्मनी उठाना चाहता है।,past year germany ne willingness prakat ki ki information manpower ke vast men skilled bhartiyon ki prtibha ka labh germany uthana chahta hai.,positive,positive
"I think it starts household by household, under the same roof.","मैं सोचती हूँ यह घर से शुरू होती है, एक ही छत के नीचे।","household by household yah ghar se shuroo hoti hai, ek hi chhat ke niche.",neutral,neutral
I usually get up at eight o 'clock.,मैं आमतौर आठ बजे सोकर उठता हूँ।,main aamtaur aath baje sokar uthta hoon.,neutral,neutral
I am uncompromisingly against all destructive machinery.,मै तमाम नाशकारी यंत्रोंका कट्टर विरोधी हूं।,i tamam nashkari machinery kattar virodhi hoon.,negative,negative
It will be the Kingdom of God on earth.,वह इस धरती पर प्रभुका राज्य होगा।,vah is earth par prbhuka kingdom god,positive,positive
Failed to write file '% s': fwrite () failed:% s'% s',फ़ाइल को लिखने में विफलः fwrite () विफलः% s,fail ko likhne men file fwrite file s,negative,negative
There is another gurudwara in Great Nicobar at Campbell Bay .,एक अन्य गुरुद्वारा ग्रेट निकोबार के कैम्पल बे में है .,ek any gurudwara gret nikobar ke kaimpal be men hai,neutral,positive
"“ That ' s the gospel truth , ” Čepek enthusiastically agreed .",“ आपकी बात सोलह आने सही है । ” <s> चेपक ने उत्साहपूर्वक हामी भरी ।,aapki bat solah aane sahi hai . s chepak ne utsahpoorvak hami bhari .,positive,positive
"If I add 2, I get 30. If I add 3, I get 31.","तो मुझे 29 मिलता है, यदि 2 जोड़ता हूँ तो 30,3 जोड़ता हूँ तो 31.","to i 29 milta hai , yadi 2 jorta hoon to 30,3 jorta hoon to 31",neutral,neutral
God created the heavens and the earth with the truth; surely in that is a sign to the believers.,अल्लाह ने आकाशों और धरती को सत्य के साथ पैदा किया। निश्चय ही इसमें ईमानवालों के लिए एक बड़ी निशानी है,created the heavens aur earth ko saty ke sath paida kiya. nishchay hi ismen eemanvalon ke lie ek bari nishani hai,positive,positive
"That however, at least as a practical force, comes in at a later stage of high perfection.","किन्तु यह स्थिति, कम-से-कम एक व्यावहारिक शक्ति के रूप में, उच्च सिद्धि की एक बाद की अवस्था में ही प्राप्त होती है।","kintu yah stage, kam-se-kam ek practical force ke roop men, high perfection ki ek bad ki avastha men hi prapt hoti hai.",neutral,positive
The Act seeks to facilitate the development of these enterprises as also enhance their competitiveness.,अधिनियम में यह भी उनकी प्रतिस्पर्धात्मकता बढ़ाने के रूप में इन उद्यमों के विकास की सुविधा के लिए करना चाहता है।,act men yah bhi unki competitiveness baane ke roop men in enterprises ke development ki suvidha ke lie karna chahta hai.,positive,neutral
During sunset Puksi region of Shanghai- Sun is still not under the horizon but has reached the line of dense smog.,सूर्यास्त के समय शंघाई का पुक्सी क्षेत्र अब तक सूरज अपने क्षितिज के नीचे तक नहीं डूबा है बल्कि यह धुंध (smog) की रेखा तक पहुँच गया है.,sun ke samay region of shanghai kshetr ab tak sooraj apne kshitij ke niche tak nahin dooba hai balki yah dhundh smog ki rekha tak pahunch gaya hai,neutral,negative
The duplicitous salesman sold the sculpture to someone else even though he had promised to sell it to us.,धोखेबाज़ बिक्रीकर्ता ने प्रतिमा हमें बेचने का वायदा करने के बावजूद उसे किसी और को बेच दी।,duplicitous salesman ne prtima hamen bechne ka vayda karne ke bavjood use kisi aur ko bech di.,negative,positive
"And who has a better religion than he who submits himself entirely to Allah? And he is the doer of good (to others) and follows the faith of Ibrahim, the upright one, and Allah took Ibrahim as a friend.","और दीन (धर्म) की स्पष्ट से उस व्यक्ति से अच्छा कौन हो सकता है, जिसने अपने आपको अल्लाह के आगे झुका दिया और इबराहीम के तरीक़े का अनुसरण करे, जो सबसे कटकर एक का हो गया था? अल्लाह ने इबराहीम को अपना घनिष्ठ मित्र बनाया था","aur religion dharm ki spasht se us vyakti se achchha kaun ho sakta hai, jisne apne aapko allah ke aage jhuka diya aur ibrahim ke tarie ka anusaran kare, jo sabse katakar ek ka ho gaya tha allah ne ibrahim ko apna ghanishth mitr banaya tha",positive,positive
"He gone to Kerodemal College of Delhi University, where he taken Science Graduate Degree.",उन्होंने बाद अध्ययन करने के लिए ये दिल्ली विश्वविद्यालय के किरोड़ीमल कॉलेज चले गए जहां इन्होंने विज्ञान स्नातक की उपाधि प्राप्त की।,unhonne bad adhyayan karne ke lie ye delhi university ke kirorimal klej chale ge jahan science graduate degree ki upadhi prapt ki.,neutral,neutral
The Backward Classes Commission was marred in conspiracy from the very beginning.,पिछड़े वर्गों का आयोग बिल्कुल प्रारंभ से ही विवादों से घिरा रहा।,backward backward classes commission bilkul prarnbh se hi vivadon se ghira raha.,negative,negative
Wait until we are told to show the window before executing the command,कमांड चलाने से पहले इंतजार करें जब तक कि विंडो दिखाने के लिए कहा जाए,command chalane se pahle wait karen jab tak ki window dikhane ke lie kaha jae,neutral,neutral
You may bring up to two witnesses to the hearing .,आप अधिक से अधिक सुनवाई में दो गवाह ला सकते हैं .,aap adhik se adhik hearing men do witnesses la sakte hain,neutral,neutral
I wonder if I could rightly call it a meeting.,पर इसको सभा कहा भी जाए या नहीं?,par isko meeting kaha bhi jae ya nahin,neutral,neutral
"is an extension of the distance formula, which is really just","दूरी फार्मूला है, जो वास्तव में सिर्फ है का विस्तार है","distance formula hai, jo vastav men sirph hai ka extension hai",neutral,neutral
XRC resource: Incorrect colour specification '%s' for property '%s'.,एक्सआरसी स्रोतसाधन: गलत रंग विशिष्टता '%s' गुणधर्म '%s' के लिए।,xrc srotsadhan : incorrect colour specification s gunadharm s ke lie.,negative,neutral
There are many particles in air which can harm the health of plans and animals (including humans) or can damage their eyesight. These are produced due to natural process and human activities. The particles not found in the air naturally or or more frequently or different than generic particles are called as pollutants.,वायु में बहुत से तत्त्व होते हैं जो पौधों और पशुओं (मानव समेत) का स्वास्थ्य कर सकते हैं या नजर ख़राब कर सकते हैं यह प्राकृतिक प्रक्रियाओं तथा मानव गतिविधियों दोनों से उत्पन्न होते हैं. वायु में प्राकृतिक रूप से नहीं पाए जाने वाले तत्व या अधिक सांद्रता के साथ या सामान्य से अलग तत्वों को प्रदूषक कहा जाता है.,air men bahut se tattv hote hain jo paudhon aur plans many particles ka health kar sakte hain ya najar rab kar sakte hain yah natural prakriyaon tatha many activities donon se utpann hote hain air men natural roop se nahin pae jane vale tatv ya adhik sandrta ke sath ya generic se different tatvon ko prdooshak kaha jata hai,negative,negative
"Danaus Umniace is another common butterfly of the plains, with black wings, marked with bluish - white streaks.",मैदानों की दूसरी सामान्य तितली डेनॉस लिम्निएस है जिसके काले पंखों पर नीलाभ-सफेद रेखाएं होती हैं।,maidanon ki doosri common butterfly dens limnies hai jiske kale pnkhon par nilabh-sphed rekhaen hoti hain.,neutral,neutral
The game has no solution. Undo or start again.,खेल के पास कोई हल नहीं है. वापस ले या फिर शुरू करें.,game ke pas koee hal nahin hai vapas le ya phir start karen,negative,negative
"I am extremely happy that Raipur Airport has been named after the saint / philosopher and visionary Swami Vivekananda. After Kolkata, Raipur is the place Swamiji spent the largest number of years of his life.",मुझे यह जानकर बहुत खुशी हुई है कि रायपुर हवाई अड्डे का नाम संत/दार्शनिक तथा स्वपनद्रष्टा स्वामी विवेकानंद के नाम पर रखा गया है।,i yah janakar bahut khushi huee hai ki raipur airport adde ka nam sntdarshnik swamiji svapanadrashta swami vivekananda ke nam par place gaya number,positive,positive
Underline color for misspelled words when using inline spelling.,इनलाइन वर्तनी प्रयोग के दौरान गलत वर्तनी वाले शब्द रंग से रेखांकित करें.,underline spelling pryog ke dauran galat spelling vale words color se rekhankit karen,neutral,neutral
"Realizing the growth of embedded systems in day - to - day life and the need for trained manpower in this promising area, C - DAC has launched a Diploma in Embedded Systems Design (DESD) for Engineers in computers, electronics and IT.","दैनिक जीवन में एंबेडेड सिस्टम एवं महत्वपूर्ण क्षेत्रों में प्रशिक्षित मानव संसाधन की बढ़ती आवश्यकता को ध्यान में रख कर सी-डैक ने कम्प्यूटर, इलेक्ट्रॉनिक्स और आइटी इंजीनियरों के लिए एंबेडेड सिस्टम डिजाइन में डिप्लोमा () पाठ्यक्रम की शुरूआत की है।","dainik jivan men enbeded sistam evn mahatvpoorn kshetron men prshikshit manav snsadhan ki bati aavashyakta ko dhyan men rakh kar si-daik ne kampyootar, ilektrniks aur aaiti injiniyron ke lie embedded systems design men diploma pathyakram ki shurooaat ki hai.",positive,positive
We have created the heavens and the earth and all that is between the two in accordance with the requirements of truth and wisdom. The Hour is surely coming. So overlook [their faults] with gracious forgiveness.,"हमने तो आकाशों और धरती को और जो कुछ उनके मध्य है, सोद्देश्य पैदा किया है, और वह क़ियामत की घड़ी तो अनिवार्यतः आनेवाली है। अतः तुम भली प्रकार दरगुज़र (क्षमा) से काम लो","hamne to heavens aur earth ko aur jo kuchh unke madhy hai , truth paida kiya hai , aur vah hour ki ghari to anivaryta aanevali hai. ata tum gracious prkar overlook forgiveness se kam requirements",positive,positive
going to be aligned at the center of the cell.,कोशिका के केंद्र में पंक्ति बद्ध होंगे.,cell ke center men pnkti baddh honge,neutral,neutral
Sending a message with an empty subject line,कोई रिक्त विषय पंक्ति के साथ एक संदेश भेजें (e),koee empty subject line ke sath ek message bhejen e,negative,negative
"Where there is no economic change, there the position of women remains the same.","जहां कहीं आर्थिक स्थिति नहीं बदली है, वहां स्त्रियों का दर्जा भी अपरिवर्तनीय रहा है।","jahan kahin economic position nahin change hai , vahan women ka darja bhi aprivartniy raha same",neutral,negative
You should pay grand rent.,तुम्हें जमीन का भाड़ा अदा करना चाहिए।,tumhen jamin ka rent grand karna chahie.,negative,positive
But that brings me to lesson number two:,तो इस तरह मैं अपने दूसरे सबक तक पहुँचती हूँ।,to is tarah main apne doosre brings tak pahunchti hoon.,neutral,positive
Web Server to Predict Hub Proteins,हब प्रोटीन की भविष्यवाणी हेतु वैब सर्वर,hub proteins ki bhavishyvani hetu web server,neutral,neutral
Mr. Vagish Shastri has bestowed scientific nature to Sanskrit Grammar.,संस्कृत के व्याकरण को वागीश शास्त्री ने वैज्ञानिक स्वरूप प्रदान किया है।,snskrit ke grammar ko vagish shastri ne scientific nature prdan kiya hai.,positive,neutral
Repayment (can be customized) Highly flexible - maximum 30 yrs.,चुकौती (कस्टमाइज़ किया जा सकता है) बहुत अधिक फ़्लेक्सिबल – अधिकतम 30 वर्ष।,repayment kastmaiz kiya ja sakta hai bahut adhik fleksibal yrs maximum flexible varsh.,positive,positive
Ask your council about anything in the tenancy agreement you do not understand.,"यदि किरायेदारी के समझोते में कोई बात आपको समझ नहीं आती, तो आ कौंसिल को पूँछे।","yadi kirayedari ke samjhote men koee bat aapko samajh nahin aati, to aa kaunsil ko poonchhe.",negative,positive
The so-called philosopher king who could rise above the stereotypes of his own party .,"एक तथाकथित दार्शनिक शासक , जो अपनी पार्टी के मानदंड़ों से ऊपर है .","ek so-called philosopher king , jo apni party ke stereotypes se oopar hai",positive,positive
In summer he spends most of his time in the verandah and in winter he basks in the early sun bare - bodied.,वे अकसर गमीँ के दिनों में बरामदे में और सर्दियों में सुबह की धूप में नंगे बदन बैठे मिल जाएंगे।,ve akasar gamin ke dinon men baramde men aur sardiyon men subah ki dhoop men nnge badan baithe mil jaenge.,neutral,neutral
yet there are over you watchers,जबकि तुमपर निगरानी करनेवाले नियुक्त हैं,jabki tumapar watchers karnevale niyukt hain,neutral,neutral
"It is He who is God in heaven, and God on earth. He is the Wise, the Knower.","वही है जो आकाशों में भी पूज्य है और धरती में भी पूज्य है और वह तत्वदर्शी, सर्वज्ञ है","knower hai jo aakashon men bhi heaven hai aur earth men bhi heaven hai aur vah tatvadarshi , sarvajnj hai",positive,positive
"The Weights and Measures unit in the Ministry of Consumer Affairs, Food and Public Distribution is the nodal agency for all activities relating to the subject.",नागरिक आपूर्ति और उपभोक्ता मामले तथा सार्वजनिक वितरण मंञालय में माप-तोल निदेशालय इस विषय से संबंधित सभी गतिविधियों को देखने वाली प्रमुख एजेंसी हैं।,nagrik food aur weights mamle tatha public distribution ministry men map-tol measures is subject se snbndhit sabhi gatividhiyon ko dekhne vali prmukh nodal hain.,neutral,neutral
Any one document which provides customer information to the satisfaction of the bank will suffice,"कोई एक ऐसा दस्तावेज काफी होगा, जिसमें बैंक की संतुष्टि के अनुरूप ग्राहक सूचना हो","koee ek aesa dastavej kaphi hoga, jismen baink ki sntushti ke anuroop grahak soochna ho",positive,positive
The prevailing colour of this breed is black and white.,इस नस्ल का सामान्य रंग काला और सफेद होता है.,is breed is black colour black and white hota hai,neutral,neutral
Chandrashekhar himself is undecided as to what he should do.,स्वयं चंद्रशेखर इस संदर्भ में अनिश्चित है कि उसे क्या करना चाहिए।,svyn chandrashekhar is sndarbh men anishchit hai ki use kya karna chahie.,neutral,negative
This message does not contain the header information required for this action.,संदेश शीर्षिका सूचना नहीं रखता है इस क्रिया के लिए जरूरी.,message header information nahin rakhta hai is action ke lie jaroori,negative,neutral
Thus a binary series of numbers would be transmitted.,इस प्रकार दिवचर श्रेणी की संख्याओं को प्रेषित किया जा सकता हैं।,is prkar binary series of numbers ko preshit kiya ja sakta hain.,neutral,neutral
"Let not those grieve thee who rush headlong into Unbelief: Not the least harm will they do to Allah: Allah 's plan is that He will give them no portion in the Hereafter, but a severe punishment.",और (ऐ रसूल) जो लोग कुफ़्र की (मदद) में पेश क़दमी कर जाते हैं उनकी वजह से तुम रन्ज न करो क्योंकि ये लोग ख़ुदा को कुछ ज़रर नहीं पहुँचा सकते (बल्कि) ख़ुदा तो ये चाहता है कि आख़ेरत में उनका हिस्सा न क़रार दे और उनके लिए बड़ा (सख्त) अज़ाब है,aur ae rasool jo log kufr ki madad men pesh dmi kar jate hain unki vajah se tum ranj n karo kyonki ye log uda ko kuchh zarar nahin pahuncha sakte balki uda to ye chahta hai ki aaerat men unka hissa n rar de aur unke lie bara sakht azab hai,negative,negative
"However, the international standards offer some guidelines, including the requirement Resident aliens in India are not given right to political participation, including voting rights but they are assured all other basic rights and freedoms. that every individual must have a remedy when a violation of rights is alleged.",किंतु अंतर्राष्ट्रीय मानदंड से कुछ निर्देश मिलते हैं जिनमें यह भी शामिल है कि यदि अधिकार-हनन की शिकायत हो तो प्रत्येक व्यक्ति उसका समाधान पा सके।,kintu international standards se kuchh guidelines other hain india yah bhi resident hai ki yadi adhikar-hanan ki shikayat ho to pratyek individual uska samadhan rights sake.,neutral,positive
"is an extension of the distance formula, which is really just","दूरी फार्मूला है, जो वास्तव में सिर्फ है का विस्तार है","distance formula hai , jo vastav men sirph hai ka extension hai",neutral,neutral
"“ We have always supported the UDF and have a right to nominate those whom we believe will help us , ” says Monsignor Paul Kakkassery , the diocese 's spokesman .","उनके प्रवक्ता मॉनसिग्नोर पॉल कक्कास्सेरी ने कहा भी , ' ' हमने हमेशा संलमो का समर्थन किया है.इसलिए हमें ऐसे लगों को मनोनीत करने का अधिकार है जिनके बारे में हमारा मानना है कि वे हमारी मदद करेंगे . ' '","unke pravakta mnsignor pl kakkasseri ne kaha bhi , hamne hamesha snlmo ka samarthan kiya haiislie hamen aese lagon ko manonit karne ka adhikar hai jinke bare men hamara manna hai ki ve hamari madad karenge",positive,positive
"And when it was said to them: Reside in this town and eat from it wherever you wish, and say, Put down from us our heavy burdens: and enter the gate making obeisance, We will forgive you your wrongs: We will give more to those who do good (to others).",और जब उनसे कहा गया कि उस गाँव में जाकर रहो सहो और उसके मेवों से जहाँ तुम्हारा जी चाहे (शौक़ से) खाओ (पियो) और मुँह से हुतमा कहते और सजदा करते हुए दरवाजे में दाखिल हो तो हम तुम्हारी ख़ताए बख्श देगें और नेकी करने वालों को हम कुछ ज्यादा ही देगें,aur jab unse kaha gaya ki us ganv men jakar raho saho aur uske mevon se jahan tumhara ji chahe shau se khao piyo aur munh se hutma kahte aur sajda karte hue gate making obeisance ho to ham tumhari tae bakhsh degen aur neki karne valon ko ham kuchh jyada hi degen,positive,positive
The Pandiya King immediately fainted and died.,पांडिय राजा उसी दम मूर्छित होकर गिर पड़े और मृत्यु ग्रस्त हो गये।,pandiya raja usi dam moorchhit hokar gir pare aur mrityu grast ho gaye.,negative,negative
So the fact that when we tried to figure out x 's that would,तो सच है कि जब हम बाहर एक्स कि होता यह पता लगाने की कोशिश की,to sach hai ki jab ham bahar eks ki hota yah pata lagane ki koshish ki,neutral,neutral
Delirium produced due to the action of a poison is known as toxic delirium.,विष की क्रिया के कारण उत्पन्न चित्त विपर्यय को विषजन्य चित्त विपर्यय कहा जाता है।,poison ki due ke karan utpann chitt viparyay ko vishajany chitt viparyay kaha jata hai.,negative,negative
