English,Hindi,Hinglish,bert_base,vader_sentiment
Program module is a file that contains instructions which are either in the form of source code or machine language.,"माड्यूल, एक संचिका होती है, जिसमें या तो स्रोत कोड या मशीन भाषा के रूप में अनुदेश निहित होते हैं।","module , ek program hoti hai , jismen ya to source code ya machine language ke form men instructions nihit hote hain.",neutral,neutral
"And to Thamud We sent their brother Sali 'h. He said:' My people! Serve Allah; you have no god other than Him. He brought you into being out of the earth, and has made you dwell in it. So ask Him to forgive you, and do turn towards Him in repentance. Indeed My Lord is near, responsive to prayers.",और (हमने) क़ौमे समूद के पास उनके भाई सालेह को (पैग़म्बर बनाकर भेजा) तो उन्होंने (अपनी क़ौम से) कहा ऐ मेरी क़ौम ख़ुदा ही की परसतिश करो उसके सिवा कोई तुम्हारा माबूद नहीं उसी ने तुमको ज़मीन (की मिट्टी) से पैदा किया और तुमको उसमें बसाया तो उससे मग़फिरत की दुआ मॉगों फिर उसकी बारगाह में तौबा करो (बेशक मेरा परवरदिगार (हर शख़्श के) क़रीब और सबकी सुनता और दुआ क़ुबूल करता है,aur hamne aume samood ke pas unke bhaee saleh ko paimbar banakar bheja to unhonne apni aum se kaha ae meri aum uda hi ki parastish karo uske siva koee tumhara mabood nahin usi ne tumko zamin ki mitti se paida kiya aur tumko usmen basaya to usse maphirat ki duaa mgon phir uski bargah men tauba karo beshak mera paravardigar har shash ke rib aur sabki sunta aur duaa ubool karta hai,positive,positive
"and, when reminded, do not remember","और जब उन्हें याद दिलाया जाता है, तो वे याद नहीं करते,","aur jab unhen yad dilaya jata hai , to ve yad nahin karte ,",neutral,neutral
you won the TED Prize 2011.,तुम्हें २०११ का टेड प्राइज़ मिल गया है.,tumhen २०११ ka ted prize mil gaya hai,positive,positive
"He gone to Kerodemal College of Delhi University, where he taken Science Graduate Degree.",उन्होंने बाद अध्ययन करने के लिए ये दिल्ली विश्वविद्यालय के किरोड़ीमल कॉलेज चले गए जहां इन्होंने विज्ञान स्नातक की उपाधि प्राप्त की।,unhonne bad science karne ke lie ye delhi university ke kirorimal college chale ge jahan inhonne vijnjan graduate ki degree prapt ki.,neutral,neutral
Then We awakened them to know which of the two groups could better calculate the length of their stay.,"फिर हमने उन्हें भेजा, ताकि मालूम करें कि दोनों गिरोहों में से किसने याद रखा है कि कितनी अवधि तक वे रहे","phir hamne unhen bheja, taki maloom karen ki calculate the length se kisne yad rakha hai ki kitni avdhi tak ve rahe",neutral,positive
Really move all photos and videos to the trash?,क्या आप वाकई रद्दी में सारे फोटो और वीडियो खिसकाना चाहते हैं?,kya aap vakee raddi men sare photos and videos khiskana chahte hain,negative,neutral
And leave them desolate waste.,और धरती को एक समतल चटियल मैदान बनाकर छोड़ेगा,aur dharti ko ek samatal desolate maidan banakar chhorega,negative,negative
Please let me see when you 're online. Thanks!,मुझे देखने के लिए जब आप ऑनलाइन हो. धन्यवाद!,mujhe dekhne ke lie jab aap ऑnlain ho dhanyvad!,positive,positive
"It is He who prevails over His creatures, and He is all - wise and aware.","उसे अपने बन्दों पर पूर्ण अधिकार प्राप्त है। और वह तत्वदर्शी, ख़बर रखनेवाला है","use apne creatures par poorn adhikar prapt hai. aur vah wise, aware rakhnevala hai",positive,positive
"It belongs to the seventh century if not earlier , and was perhaps intended originally for the Buddhist creed , but was adopted later for a Vishnu temple , the principal deity being a recumbent Vishnu , or Anantasayin .","यदि यह और पहले का नहीं , तो भी सातवीं शताब्दी का बना है और शायद मूल रूप से बौद्ध मत के लिए था , किंतु बाद में विष्णु मंदिर में रूपांतरित कर दिया गया जिसमें प्रमुख देवता लेटे हुए विष्णु या अनंतशायी हैं .","yadi yah aur pahle ka nahin , to bhi seventh century ka bana hai aur earlier mool roop se buddhist creed ke lie tha , kintu bad men vishnu temple men roopantrit kar diya gaya jismen principal deity recumbent hue vishnu ya anantasayin hain",neutral,neutral
An organism or individual having a diploid set of chromosomes derived from each parent.,कोई अवयव या जीव जिस में माता और पिता इन दोनों से ही प्राप्त गुणसुत्र का एक दोहरा गुट है।,koee organism or individual jis men mata aur pita in donon se hi prapt gunsutr ka ek dohra gut individual,neutral,neutral
But the physical love is only a bridge to cross over to the other bank葉he Annihilation of self.,पर शारीरिक प्रेम दूसरे तट-आत्म-हनन-पर पहुँचने का सेतु मात्र है।,par sharirik prem doosre tat-aatm-hanan-par bridge to cross physical love,neutral,positive
His mother was darning a torn sock over a wooden mushroom.,उसकी माँ लकड़ी के बने कुकुरमुत्ते पर कोई फटा मोज़ा सी रही थी।,uski man lakari ke bane kukurmutte par koee phata darning a torn thi.,negative,negative
Every soul shall have a taste of death: And only on the Day of Judgment shall you be paid your full recompense. Only he who is saved far from the Fire and admitted to the Garden will have attained the object (of Life): For the life of this world is but goods and chattels of deception.,"प्रत्येक जीव मृत्यु का मज़ा चखनेवाला है, और तुम्हें तो क़ियामत के दिन पूरा-पूरा बदला दे दिया जाएगा। अतः जिसे आग (जहन्नम) से हटाकर जन्नत में दाख़िल कर दिया गया, वह सफल रहा। रहा सांसारिक जीवन, तो वह माया-सामग्री के सिवा कुछ भी नहीं","pratyek jiv taste of death chakhnevala hai, aur tumhen to iyamat ke din poora-poora badla de diya jaega. ata jise aag jahannam se hatakar jannat men dail kar diya gaya, vah saphal raha. raha sansarik jivan, to vah maya-samagri ke siva kuchh bhi nahin",negative,negative
"Fluctuations in the production of raw jute, low yield, cost inflation, labour unrest, uncertain demand and obsolete machinery are some of its major problems.","कच्चे जूट के उत्पादन में उतार-चढ़ाव, कम पैदावार, लागत स्फीती, श्रम असंतोष, अनिश्चित मांग, पुरानी मशीनें, कुछ इसकी प्रमुख समस्याऍं हैं.","fluctuations jute ke production men utar-chaav , low yield , cost sphiti , labour unrest , uncertain demand , obsolete machinery , kuchh iski major problems hain",negative,negative
a lot of young people with a demographic dividend,एक जनसांख्यिकीय लाभांश के साथ कई युवा लोग,ek demographic dividend ke sath kee young lot,neutral,neutral
"And remember Our servants Ibrahim and Ishaq and Yaqoub, men of power and insight.",और (ऐ रसूल) हमारे बन्दों में इबराहीम और इसहाक़ और याकूब को याद करो जो कुवत और बसीरत वाले थे,aur ae rasool hamare bandon men ibrahim aur isha aur yakoob ko yad karo jo kuvat aur basirat vale the,positive,neutral
"Moreover , even if we resolved the dispute by circumscribing its scope to some particular field of human endeavour and did agree on what is ' excellence ' , there is no knowing that it would be passed on to children .","और किसी विशिष्ट क्षेत्र के संदर्भ में उत्कृष्टता का अर्थ क़्या होगा , इस बात का निर्णय हम लोगों ने कर भी लिया तब भी आनेवाली पीढ़ी की संतानों में यह गुण दिखाई देगा , इस बात की कोई गारंटी नहीं दी जा सकती .","aur kisi particular scope ke sndarbh men human ka arth ya children , is moreover ka nirnay ham logon ne kar bhi liya tab bhi aanevali pii ki sntanon men yah gun dikhaee dega , is moreover ki koee garnti nahin di ja dispute",neutral,positive
Candytuft is mostly cultivated for ornamental purposes.,चांदी टफ या कैंडीटफ्ट मुख्यत सजावटी उद्देश्यों के लिए उगाए जाते हैं,chandi taph ya kainditapht mukhyat ornamental purposes ke lie ugae jate hain,neutral,neutral
Cannot attach CMS Enveloped data,CMS लिफाफाकृत आंकड़ा संलग्न नहीं कर सकता है,CMS attach data snlagn nahin kar sakta hai,negative,neutral
"In truth, when its desires are fulfilled, it returns to its own place and enjoys the happiness that is the Self.","वस्तुतः जब उसकी इच्छाएँ पूरी हो जाती है तो वह अपने स्थान पर वापस आ जाता है, और आनंद का, आत्मा का उपयोग करता है।","vastuta jab uski ichchhaen poori ho jati hai to vah apne sthan par vapas aa jata hai, aur aannd ka, aatma ka upyog karta hai.",positive,positive
"Let's see, let's do minus 5 / 7 divided by 10 / 3.","देखे, करे नकारात्मक 5/7 विभाजित है 10/3 से","dekhe, kare minus 57 divided hai 103 se",neutral,neutral
In tha Law there are a number of bylaws under one law.,विधि में एक नियम के अंतर्गत कई उप नियम होते हैं।,vidhi men ek niyam ke antargat kee up niyam hote number,neutral,positive
In the Gardens of delight (Paradise).,नेमत भरी जन्नतों में होंगे;,delight bhari gardens men honge,positive,positive
"Last week , transporters in Delhi were up in arms against him , and , on April 10 , the first fir alleging a case of cheating and detailing his role in the CNG kit scam , was lodged at a Delhi police station .",दिल्ली के ट्रांसपोर्टरों ने एकजुट हो 10 अप्रैल को उनके खिलफ धोखाधड़ी के आरोप के साथ सीएनजी किट घोटाले में उनकी भूमिका बताते हे प्राथमिकी दर्ज करवाई .,delhi ke last ne ekjut ho 10 april ko unke khilaph cheating ke aarop ke sath cng kit scam men unki role batate he fir darj karvaee,negative,negative
"So, a smaller group, whether it is called a steering committee or something else, is needed which can be more active and can meet more frequently and with less expenses.","इसीलिये एक ज्यादा छोटे समूह की जरूरत है, चाहे उसे आप कार्य संचालन समिति कहें या कुछ और, जो साल में कई बार मिल सके, अधिक सक्रिय हो सके और कम खर्च से काम चला सके।","isiliye ek jyada smaller group ki jaroorat hai , something use aap kary steering committee kahen ya kuchh aur , jo sal men kee bar mil sake , adhik active ho sake aur less kharch se kam chala sake.",neutral,positive
They felt there wasn 't enough progress,उन्होंने महसूस किया कि वहाँ पर्याप्त प्रगति नहीं थी,unhonne wasn kiya ki vahan paryapt progress nahin thi,negative,positive
Then it goes back to potential energy again.,तो यह वापस संभावित ऊर्जा को फिर से चला जाता है।,to yah vapas potential energy ko phir se chala jata hai.,neutral,positive
But during his father 's gall - bladder operation he admitted him to a paying bed at the Bangur Hospital.,बाप के गाँल ब्लाडर का ऑपरेशन कराया बाँगुर हास्पीटल के पेइंग बेड भर्ती करा कर।,bap ke ganl bladar ka ऑpreshan karaya bangur haspital ke peing bed bharti kara kar.,neutral,positive
Wind speed = %d kilometers/hour,हवा की गती = %d किलोमीटर/प्रतिघंटा,wind ki speed d kilomitarprtighnta,neutral,neutral
"If selected, you will be notified when entering an SSL enabled site","यदि चुना गया है, जब आप एसएसएल सक्षम साइट पर प्रवेश करते हैं तो आपको सूचित किया जाएगा","yadi selected gaya hai, jab aap esesel enabled site par prvesh karte hain to aapko soochit kiya jaega",neutral,neutral
"Each vertex has a label, and these labels must have the following property.","प्रत्येक वर्टेक्स एक लेबल है, और इन लेबल निम्न गुण होना आवश्यक है।","pratyek varteks ek label hai, aur in label nimn gun hona aavashyak hai.",neutral,neutral
"He said, “O my son, do not relate your vision to your brothers, lest they plot and scheme against you. Satan is man 's sworn enemy.",याक़ूब ने कहा ऐ बेटा (देखो ख़बरदार) कहीं अपना ख्वाब अपने भाईयों से न दोहराना (वरना) वह लोग तुम्हारे लिए मक्कारी की तदबीर करने लगेगें इसमें तो शक़ ही नहीं कि शैतान आदमी का खुला हुआ दुश्मन है,yaoob ne kaha ae son dekho bardar lest apna vision apne brothers se n dohrana varna vah log tumhare lie scheme ki tadbir karne lagegen ismen to sha hi nahin ki shaitan man ka sworn huaa enemy hai,negative,negative
I know that the Bodhisattva lovingly regards all living creatures to deliver them from misery!,मै जानता हूं कि बोधिसत्व सभी प्राणियों पर अपनी कृपा भाव बिखेरे हुए हैं!,mai janta hoon ki bodhisatv sabhi living par apni kripa bhav bikhere hue hain!,positive,positive
Greek 'ouranos' for 'heaven'. Named after the planet Uranus.,'स्वर्ग' के लिए यूनानी में 'क्वारानोस'. यूरेनस ग्रह के ऊपर नाम रखा गया,svarg ke lie greek men kvaranos planet uranus ke oopar nam rakha gaya,neutral,positive
Failed to unlock lock file '% s' '% s',लॉक फ़ाइल को अन-लॉक करने में असफ़ल,lock file ko an-lk karne men asafal,negative,negative
We have tried to correct them.,हमने उन्हें सुधारने की कोशिश की है।,hamne unhen sudharne ki koshish ki hai.,neutral,neutral
"Having nothing worthwhile to do, he organized a society of like - minded persons to divert his mind.",कुछ खास काम न हाने के कारण उन्होंने अपना ध्यान दूसरी ओर लगााने की दृष्टि से अपने जैसे विचार वाले लोगों की एक सोसायटी बना ली।,kuchh nothing kam n hane ke karan unhonne apna mind society or lagaane ki drishti se apne jaise vichar vale persons ki ek sosayti bana li.,negative,positive
"We think doodling is something you do when you lose focus,","ऐसा माना जाता है कि डूडल करने वाले का ध्यान भंग हो चुका है,","aesa mana jata hai ki doodling karne vale ka focus bhng ho chuka hai,",neutral,negative
Anaerobic is a technical word which literally means without oxygen.,अनॉक्सीय एक तांत्रिक शब्द है जिसका शाब्दिक अर्थ है बीना प्राणवायु के।,anksiy ek tantrik word hai jiska shabdik arth hai technical oxygen ke.,negative,neutral
"He was born in the city of Surat in Gujarat on 24th August, 1833.","24 अगस्त, 1833 को उसका जन्म गुजरात के सूरत नगर में हुआ।","24 august, 1833 ko uska janm gujrat ke soorat nagar men huaa.",neutral,neutral
We 're going to win because we have dreams.,हम जीतने वाले हैं क्योंकि हमारे पास एक सपना है।,ham dreams vale hain kyonki hamare pas ek sapna hai.,positive,positive
He is the Lord of the heavens and the earth and all that is between them. He is the Beneficent God and no one will be able to address Him.,"वह आकाशों और धरती का और जो कुछ उनके बीच है सबका रब है, अत्यन्त कृपाशील है, उसके सामने बात करना उनके बस में नहीं होगा","vah lord aur earth ka aur jo kuchh unke bich hai beneficent god hai , atyant kripashil hai , uske samne bat karna unke bas men nahin hoga",positive,positive
"The region was endemic for malaria, Kala - a - zar and leprosy.","यह क्षेत्र मलेरिया, कालाजार और कुष्ठ रोग से प्रभावित था।","yah region malaria, kala aur leprosy rog se prbhavit tha.",negative,neutral
The whole of Rashtrapati Bhavan would be with them in their efforts to bring up their children.,उनके बच्चों की परवरिश में पूरा राष्ट्रपति भवन उनके साथ है।,unke children ki paravrish men poora rashtrapati bhavan unke sath whole,positive,neutral
“It 's nice for swimming there. ”,पानी में तैरने का वहाँ बहुत बढ़िया इन्तज़ाम है।,pani men nice ka vahan bahut baiya intazam hai.,positive,positive
Water resources development and management will have to be planned for a hydrological unit.,एक हाइड्रोलॉजिकल इकाई के लिए जल संसाधन विकास और प्रबंधन की योजना बनानी होगी।,ek hydrological unit ke lie jal snsadhan development and management ki yojna banani hogi.,neutral,neutral
The Madras High Court was a pioneer in the enrolment of women.,मद्रास उच्च न्यायालय महिलाओं के प्रवेश में भी अग्रणी रहा।,madras high court women ke enrolment men bhi pioneer raha.,positive,neutral
We have not heard of any such thing in the old religion. This is nothing but a fabrication.,हम लोगों ने तो ये बात पिछले दीन में कभी सुनी भी नहीं हो न हो ये उसकी मन गढ़ंत है,ham logon ne to ye bat pichhle din men kabhi suni bhi nahin ho n ho ye uski man gant hai,negative,neutral
There is a lesson for you concerning cattle. We provide you with drink from their bellies and many other benefits. You can consume them as meat.,और निश्चय ही तुम्हारे लिए चौपायों में भी एक शिक्षा है। उनके पेटों में जो कुछ है उसमें से हम तुम्हें पिलाते है। औऱ तुम्हारे लिए उनमें बहुत-से फ़ायदे है और उन्हें तुम खाते भी हो,aur nishchay hi lesson lie cattle men bhi ek shiksha hai. unke bellies men jo kuchh hai drink se ham tumhen pilate hai. au lesson lie unmen bahut-se benefits hai aur unhen tum khate bhi ho,positive,positive
Ganesh Chaturthi and Janmashtmi are the other two festivals which are celebrated with lots of fun and frolic.,इनके अलावा गणेश चतुर्थी और जन्माष्टमी कुछ अधिक धूम-धाम के संग मनाये जाते हैं।,other alava ganesh chaturthi aur janmashtmi kuchh adhik dhoom-dham ke sng janmashtmi jate hain.,positive,positive
Bharavi was almost a contemporary of Kalidasa.,भारवि करीब करीब कालिदास के समकालीन थे.,bharavi karib karib kalidas ke contemporary the,neutral,neutral
Disability and Housing Policy housingpolicy_disability@detr.gov.uk,अपंग और रिहाइश के बारे में नीति housingpolicy_disability@detr.gov.uk,disability aur housing ke bare men policy housingpolicy_disability detrgovuk,neutral,neutral
[it will be] lowering and exalting.,कि किसी को पस्त करेगी किसी को बुलन्द,ki kisi ko exalting karegi kisi ko buland,neutral,negative
"Thereafter, We utterly destroyed the rest,",(और हलाक हो गयी) फिर हमने उन लोगों को हलाक कर डाला,aur destroyed the rest phir hamne un logon ko utterly kar dala,negative,negative
"PARTLY flattered by Mussolini 's courtship and partly curious to see for himself this colourful personality and its impact on an ancient and lively culture, Tagore accepted an invitation from Italy and sailed for Naples on 15 May 1926.",कुछ तो मुसोलिनी के सम्मान निवेदन से प्रसन्न होकर और कुछ उसके रंगारंग व्यक्तित्व और प्राचीन तथा जीवंत संस्कृति पर उसके प्रभाव को देखने की चाह से रवीन्द्रनाथ ने इटली का आमंत्रण स्वीकार किया. वे 15 मई 1926 को नेपल्स के लिए रवाना हुए.,kuchh to musolini ke samman nivedan se prasann hokar aur kuchh uske colourful personality aur ancient and lively snskriti par uske prbhav ko dekhne ki chah se ravindrnath ne itli ka aamntran svikar kiya ve 15 mee 1926 ko nepals ke lie ravana hue,positive,positive
India is grateful for Tanzania’s support to India’s claim for permanent membership of the UN Security Council.,"भारत, संयुक्त राष्ट्र सुरक्षा परिषद की स्थायी सदस्यता की हमारी दावेदारी के प्रति तंजानिया के समर्थन के॒ लिए आभारी है।","india , un rashtr security council ki permanent membership ki claim ke prti tanzania ke support ke lie grateful hai.",positive,positive
that astonished the media business.,जिन्होनें इन मीडिया कंपनियों की हवा निकाल दी।,business in media knpniyon ki hava nikal di.,positive,positive
